{
  "version": 1,
  "claim": {
    "version": 1,
    "agent_id": "agent_a",
    "attempt_id": "tick_1",
    "generation": 1,
    "checkpoint_revision": 0,
    "claimed_at_ms": 1790000000000,
    "state": "held"
  },
  "run_id": null,
  "config_revision": "config_1",
  "bundle_ref": {
    "key": "bundle_1",
    "sha256": "aaaaaaaaaaaaaaaaaaaaaaaaaaaaaaaaaaaaaaaaaaaaaaaaaaaaaaaaaaaaaaaa",
    "bytes": 2
  },
  "ledger_snapshot_ref": {
    "key": "ledger_1",
    "sha256": "aaaaaaaaaaaaaaaaaaaaaaaaaaaaaaaaaaaaaaaaaaaaaaaaaaaaaaaaaaaaaaaa",
    "bytes": 2
  },
  "content_fds": [
    {
      "fd": 6,
      "role": "bundle",
      "ref": {
        "key": "bundle_1",
        "sha256": "aaaaaaaaaaaaaaaaaaaaaaaaaaaaaaaaaaaaaaaaaaaaaaaaaaaaaaaaaaaaaaaa",
        "bytes": 2
      }
    },
    {
      "fd": 7,
      "role": "ledger",
      "ref": {
        "key": "ledger_1",
        "sha256": "aaaaaaaaaaaaaaaaaaaaaaaaaaaaaaaaaaaaaaaaaaaaaaaaaaaaaaaaaaaaaaaa",
        "bytes": 2
      }
    }
  ]
}
